Заголовок;Title; Description;Общий вопрос
Как приготовить омлет ;Способы вкусного и быстрого приготовления омлета;Как вкусно приготовить омлет . Рецепт приготовления омлета;как приготовить омлет 
Как приготовить лаваш с капустой;Способы вкусного и быстрого приготовления лаваш с капустой;Как вкусно приготовить лаваш с капустой. Рецепт приготовления лаваш с капустой;как приготовить лаваш с капустой
Как приготовить шаурму;Способы вкусного и быстрого приготовления шаурмы;Как вкусно приготовить шаурму. Рецепт приготовления шаурмы;как приготовить шаурму
Как приготовить гарнир из овощей;Способы вкусного и быстрого приготовления гарнира из овощей ;Как вкусно приготовить гарнир из овощей. Рецепт приготовления гарнира из овощей ;как приготовить гарнир из овощей 
Как приготовить запеченную рыбу с овощами;Способы вкусного и быстрого приготовления запеченной рыбы с овощами;Как вкусно приготовить запеченную рыбу с овощами. Рецепт приготовления запеченной рыбы с овощами;как приготовить запеченную рыбу с овощами
Как приготовить почки со спаржей;Способы вкусного и быстрого приготовления почек со спаржей;Как вкусно приготовить почки со спаржей. Рецепт приготовления почек со спаржей;как приготовить почки со спаржей
Как приготовить жареную мойву;Способы вкусного и быстрого приготовления жареной мойвы;Как вкусно приготовить жареную мойву. Рецепт приготовления жареной мойвы;как приготовить жареную мойву
Как приготовить сосиски с сыром;Способы вкусного и быстрого приготовления сосисок с сыром;Как вкусно приготовить сосиски с сыром. Рецепт приготовления сосисок с сыром;как приготовить сосиски с сыром
Как приготовить рыбу в кляре;Способы вкусного и быстрого приготовления рыбы в кляре;Как вкусно приготовить рыбу в кляре. Рецепт приготовления рыбы в кляре;как приготовить рыбу в кляре
Как приготовить тушеную капусту ;Способы вкусного и быстрого приготовления тушеной капусты;Как вкусно приготовить тушеную капусту. Рецепт приготовления тушеной капусты;как приготовить тушеную капусту
Как приготовить картофельные клецки;Способы вкусного и быстрого приготовления картофельных клецок;Как вкусно приготовить картофельные клецки. Рецепт приготовления картофельных клецок;как приготовить картофельные клецки
Как приготовить котлеты из рисовой каши;Способы вкусного и быстрого приготовления котлет из рисовой каши;Как вкусно приготовить котлеты из рисовой каши. Рецепт приготовления котлет из рисовой каши;как приготовить котлеты из рисовой каши
Как приготовить жареную картошку с шампиньонами;Способы вкусного и быстрого приготовления жареной картошки с шампиньонами;Как вкусно приготовить жареную картошку с шампиньонами. Рецепт приготовления жареной картошки с шампиньонами;как приготовить жареную картошку с шампиньонами
Как приготовить гарнир из кабачков;Рецепты вкусного гарнира из кабачков, который легко приготовить дома;Простые секреты вкусного гарнира из кабачков. Научись готовить лучше!;как приготовить гарнир из кабачков
Как приготовить глазированную морковь;Рецепты вкусной глазированной моркови , которую легко приготовить дома;Простые секреты вкусной глазированной моркови . Научись готовить лучше!;как приготовить глазированную морковь
Как приготовить картошку в мультиварке;Рецепты вкусной картошки в мультиварке, которую легко приготовить дома;Простые секреты вкусной картошки в мультиварке. Научись готовить лучше!;как приготовить картошку в мультиварке
Как приготовить мясо с горошком;Рецепты вкусного мяса с горошком , которое легко приготовить дома;Простые секреты вкусного мяса с горошком . Научись готовить лучше!;как приготовить мясо с горошком
Как приготовить гарнир из спаржи;Рецепты вкусного гарнира из спаржи, который легко приготовить дома;Простые секреты вкусного гарнира из спаржи. Научись готовить лучше!;как приготовить гарнир из спаржи
Как приготовить картофельное пюре;Рецепты вкусного картофельного пюре , которое легко приготовить дома;Простые секреты вкусного картофельного пюре . Научись готовить лучше!;как приготовить картофельное пюре
Как приготовить картошку в духовке ;Рецепты вкусной картошки в духовке, которую легко приготовить дома;Простые секреты вкусной картошки в духовке. Научись готовить лучше!;как приготовить картошку в духовке 
Как приготовить шпинат;Рецепты вкусного шпината, который легко приготовить дома;Простые секреты вкусного шпината . Научись готовить лучше!;как приготовить шпинат
Как приготовить гарнир из свеклы;Рецепты вкусного гарнира свеклы , который легко приготовить дома;Простые секреты вкусного гарнира свеклы. Научись готовить лучше!;как приготовить гарнир из свеклы
Как приготовить цветную капусту;Рецепты вкусной цветной капусты , которую легко приготовить дома;Простые секреты вкусной цветной капусты . Научись готовить лучше!;как приготовить цветную капусту
Как приготовить гарнир из брокколи;Рецепты вкусного гарнира из брокколи, который легко приготовить дома;Простые секреты вкусного гарнира из брокколи. Научись готовить лучше!;как приготовить гарнир из брокколи
Как приготовить гарнир из риса с бобовыми;Рецепты вкусного гарнира из риса с бобовыми, который легко приготовить дома;Простые секреты вкусного гарнира из риса с бобовыми. Научись готовить лучше!;как приготовить гарнир из риса с бобовыми
Как приготовить спагетти с курицей;Рецепты вкусного спагетти с курицей, которое легко приготовить дома;Простые секреты вкусного спагетти с курицей . Научись готовить лучше!;как приготовить спагетти с курицей
Как приготовить макароны с грибами;Рецепты вкусных макарон с грибами, которые легко приготовить дома;Простые секреты вкусных макарон с грибами. Научись готовить лучше!;как приготовить макароны с грибами
Как приготовить макароны с овощами;Рецепты вкусных макарон с овощами, которые легко приготовить дома;Простые секреты вкусных макарон с овощами. Научись готовить лучше!;как приготовить макароны с овощами
Как приготовить макароны с мясом;Рецепты вкусных макарон с мясом , которые легко приготовить дома;Простые секреты вкусных макарон с мясом . Научись готовить лучше!;как приготовить макароны с мясом
Как приготовить яичную лапшу с мясом;Рецепты вкусной яичной лапши с мясом, которую легко приготовить дома;Простые секреты вкусной яичную лапшу с мясом. Научись готовить лучше!;как приготовить яичную лапшу с мясом
Как приготовить макароны с фаршем;Рецепты вкусный макарон с фаршем, которые легко приготовить дома;Простые секреты вкусных макароны с фаршем. Научись готовить лучше!;как приготовить макароны с фаршем
Как приготовить макаронную запеканку;Рецепты вкусной макаронной запеканки, которую легко приготовить дома;Простые секреты вкусной макаронной запеканки. Научись готовить лучше!;как приготовить макаронную запеканку
Как приготовить бефстроганов;Рецепты вкусного бефстроганов, который легко приготовить дома;Простые секреты вкусного бефстроганов. Научись готовить лучше!;как приготовить бефстроганов
Как приготовить биточки;Рецепты вкусных биточков , которые легко приготовить дома;Простые секреты вкусных биточков. Научись готовить лучше!;как приготовить биточки
Как приготовить бифштекс;Рецепты вкусного бифштекса , который легко приготовить дома;Простые секреты вкусного бифштекса . Научись готовить лучше!;как приготовить бифштекс
Как приготовить картошку в горшочке;Рецепты вкусной картошки в горшочке, которую легко приготовить дома;Простые секреты вкусной  картошки в горшочке. Научись готовить лучше!;как приготовить  картошку в горшочке
Как приготовить овощи в горшочках;Рецепты вкусных овощей в горшочках, которые легко приготовить дома;Простые секреты вкусных овощей в горшочках. Научись готовить лучше!;как приготовить овощи в горшочках
Как приготовить кальмары в кляре;Рецепты вкусных кальмаров в кляре, которые легко приготовить дома;Простые секреты вкусных кальмаров в кляре. Научись готовить лучше!;как приготовить кальмары в кляре
Как приготовить капусту;Рецепты вкусной капусты, которую легко приготовить дома;Простые секреты вкусной капусты. Научись готовить лучше!;как приготовить капусту
Как приготовить рыбу;Рецепты вкусной рыбы , которую легко приготовить дома;Простые секреты вкусной рыбы. Научись готовить лучше!;как приготовить рыбу
Как приготовить креветки;Рецепты вкусных креветок, которые легко приготовить дома;Простые секреты вкусных креветок. Научись готовить лучше!;как приготовить креветки
Как приготовить курицу ;Рецепты вкусной курицы, которую легко приготовить дома;Простые секреты вкусной курицы. Научись готовить лучше!;как приготовить курицу 
Как приготовить рыбное филе;Рецепты вкусного рыбного филе, которое легко приготовить дома;Простые секреты вкусного рыбного филе. Научись готовить лучше!;как приготовить рыбное филе
Как приготовить мясное филе;Рецепты вкусного мясного филе, которое легко приготовить дома;Простые секреты вкусного мясного Научись готовить лучше!;как приготовить мясное филе
Как приготовить ленивые вареники;Рецепты вкусных ленивых вареников, которые легко приготовить дома;Простые секреты вкусных ленивых вареников. Научись готовить лучше!;как приготовить ленивые вареники
Как приготовить галушки;Рецепты вкусных галушек , которые легко приготовить дома;Простые секреты вкусных галушек. Научись готовить лучше!;как приготовить галушки
Как приготовить голубцы в мультиварке;Рецепты вкусных голубцов в мультиварке, которые легко приготовить дома;Простые секреты вкусных голубцы в мультиварке. Научись готовить лучше!;как приготовить голубцы в мультиварке
Как приготовить ленивые голубцы;Рецепты вкусных ленивых голубцов, которые легко приготовить дома;Простые секреты вкусных ленивых голубцов . Научись готовить лучше!;как приготовить ленивые голубцы
Как приготовить гуляш из говядины;Рецепты вкусного гуляша из говядины, который легко приготовить дома;Простые секреты вкусного гуляша из говядины. Научись готовить лучше!;как приготовить гуляш из говядины
Как приготовить гуляш из свинины;Рецепты вкусного гуляша из свинины, который легко приготовить дома;Простые секреты вкусного гуляша из свинины. Научись готовить лучше!;как приготовить гуляш из свинины
Как приготовить гуляш из курицы;Рецепты вкусного гуляша из курицы, который легко приготовить дома;Простые секреты вкусного гуляша из курицы. Научись готовить лучше!;как приготовить гуляш из курицы
Как приготовить жаркое ;Рецепты вкусного жаркого, которое легко приготовить дома;Простые секреты вкусного жаркого. Научись готовить лучше!;как приготовить жаркое 
Как приготовить жаркое с картошкой в мультиварке;Рецепты вкусного жаркого с картошкой в мультиварке, которое легко приготовить дома;Простые секреты вкусного жаркого с картошкой в мультиварке. Научись готовить лучше!;как приготовить жаркое с картошкой в мультиварке
Как приготовить мясные зразы;Рецепты вкусных мясных зраз, которые легко приготовить дома;Простые секреты вкусных мясных зраз. Научись готовить лучше!;как приготовить зразы мясные
Как приготовить картофельные зразы ;Рецепты вкусных картофельных зразов, которые легко приготовить дома;Простые секреты вкусных картофельных зразов. Научись готовить лучше!;как приготовить картофельные зразы 
Как приготовить зразы с грибами;Рецепты вкусных зразов с грибами, которые легко приготовить дома;Простые секреты вкусных зразов с грибами. Научись готовить лучше!;как приготовить зразы с грибами
Как приготовить ёжики из фарша;Рецепты вкусных ёжиков из фарша, которые легко приготовить дома;Простые секреты вкусных ёжиков из фарша. Научись готовить лучше!;как приготовить ёжики из фарша
Как приготовить запеканку;Рецепты вкусной запеканки, которую легко приготовить дома;Простые секреты вкусной запеканки. Научись готовить лучше!;как приготовить запеканку
Как приготовить кабачки с фаршем;Рецепты вкусных кабачков с фаршем, которые легко приготовить дома;Простые секреты вкусных кабачков с фаршем. Научись готовить лучше!;как приготовить кабачки с фаршем
Как приготовить куриный фарш ;Рецепты вкусного куриного фарша, который легко приготовить дома;Простые секреты вкусного фарша: куриного, рыбного, свиного. Научись готовить лучше!;как приготовить куриный фарш
Как приготовить рыбный фарш;Рецепты вкусного рыбного фарша, который легко приготовить дома;Простые секреты вкусного рыбного фарша. Научись готовить лучше!;как приготовить рыбный фарш 
Как приготовить свиной фарш ;Рецепты вкусного свиного фарша,  который легко приготовить дома;Простые секреты вкусного свиного фарша. Научись готовить лучше!;как приготовить свиной фарш
Как приготовить говяжий фарш;Рецепты вкусного говяжьего фарша, который легко приготовить дома;Простые секреты вкусного говяжьего фарша. Научись готовить лучше!;как приготовить говяжий фарш
Как приготовить  картофельное пюре;Рецепты вкусного картофельное пюре, которое легко приготовить дома;Простые секреты вкусного картофельного пюре. Научись готовить лучше!;как приготовить картофельное пюре
Как приготовить картошку с мясом;Рецепты вкусной картошки с мясом, которую легко приготовить дома;Простые секреты вкусной картошки с мясом. Научись готовить лучше!;как приготовить картошку с мясом
Как приготовить картошку с грибами;Рецепты вкусной картошки с грибами, которую легко приготовить дома;Простые секреты вкусной картошки с грибами. Научись готовить лучше!;как приготовить картошку с грибами
Как приготовить картошку с капустой;Рецепты вкусной картошки с капустой, которую легко приготовить дома;Простые секреты вкусной картошки с капустой. Научись готовить лучше!;как приготовить картошку с капустной
Как приготовить детские каши;Рецепты вкусных  детских каш, которые легко приготовить дома;Простые секреты вкусных  детских каши. Научись готовить лучше!;как приготовить  детские каши
Как приготовить котлеты из капусты;Рецепты вкусные овощные котлеты из капусты, которые легко приготовить дома;Простые секреты вкусные овощные котлеты из капусты. Научись готовить лучше!;как приготовить овощные котлеты из капусты
Как приготовить овощные котлеты из моркови;Рецепты вкусные овощные котлеты из моркови, которые легко приготовить дома;Простые секреты вкусных овощных котлет из моркови. Научись готовить лучше!;как приготовить овощные котлеты из моркови
