Заголовок;Title; Description;Общий вопрос
Как приготовить овощные котлеты из картофеля;Рецепты вкусных овощных котлет из картофеля, которые легко приготовить дома;Простые секреты вкусных овощных котлет из картофеля. Научись готовить лучше!;как приготовить овощные котлеты из картофеля
Как приготовить свиные котлеты ;Рецепты вкусных свиных котлет, которые легко приготовить дома;Простые секреты вкусных свиных котлет. Научись готовить лучше!;как приготовить свиные котлеты
Как приготовить говяжьи котлеты ;Рецепты вкусных говяжьих котлет, которые легко приготовить дома;Простые секреты вкусных говяжьих котлет. Научись готовить лучше!;как приготовить говяжьи котлеты
Как приготовить куриные котлеты;Рецепты вкусных куриных котлет, которые легко приготовить дома;Простые секреты вкусных куриных котлет. Научись готовить лучше!;как приготовить куриные котлеты
Как приготовить печёночные котлеты;Рецепты вкусных печёночных котлет, которые легко приготовить дома;Простые секреты вкусных печёночных котлет. Научись готовить лучше!;как приготовить печёночные котлеты
Как приготовить рыбные котлеты ;Рецепты вкусных рыбных котлет, которые легко приготовить дома;Простые секреты вкусных рыбных котлет. Научись готовить лучше!;как приготовить рыбные котлеты
Как приготовить котлеты с сыром;Рецепты вкусных котлет с сыром, которые легко приготовить дома;Простые секреты вкусных котлет с сыром. Научись готовить лучше!;как приготовить котлеты с сыром
Как приготовить котлеты по-киевски;Рецепты вкусных котлет по-киевски, которые легко приготовить дома;Простые секреты вкусных котлет по-киевски. Научись готовить лучше!;как приготовить котлеты по-киевски
Как приготовить котлеты на пару;Рецепты вкусных котлет на пару, которые легко приготовить дома;Простые секреты вкусных котлет на пару. Научись готовить лучше!;как приготовить котлеты на пару
Как приготовить Пожарские котлеты;Рецепты вкусных Пожарских котлет, которые легко приготовить дома;Простые секреты вкусных Пожарских котлет. Научись готовить лучше!;как приготовить пожарские котлеты 
Как приготовить рубленные котлеты ;Рецепты вкусных рубленных котлет, которые легко приготовить дома;Простые секреты вкусных рубленных котлет. Научись готовить лучше!;как приготовить рубленные котлеты 
Как приготовить крокеты;Рецепты вкусных крокетов, которые легко приготовить дома;Простые секреты вкусных крокетов . Научись готовить лучше!;как приготовить крокеты
Как приготовить лапшу;Рецепты вкусной лапши, которую легко приготовить дома;Простые секреты вкусной лапши. Научись готовить лучше!;как приготовить лапшу
Как приготовить лечо;Рецепты вкусного лечо, которое легко приготовить дома;Простые секреты вкусного лечо. Научись готовить лучше!;как приготовить лечо
Как приготовить наггетсы;Рецепты вкусных наггетсов , которые легко приготовить дома;Простые секреты вкусных наггетсов. Научись готовить лучше!;как приготовить наггетсы
Как приготовить детский омлет;Рецепты вкусного детского омлета, который легко приготовить дома;Простые секреты вкусного детского омлета. Научись готовить лучше!;как приготовить детский омлет
Как приготовить отбивные из говядины;Рецепты вкусных отбивных из говядины, которые легко приготовить дома;Простые секреты вкусных отбивных из говядины. Научись готовить лучше!;как приготовить отбивные из говядины
Как приготовить отбивные из свинины;Рецепты вкусных отбивных из свинины, которые легко приготовить дома;Простые секреты вкусных отбивных из свинины. Научись готовить лучше!;как приготовить отбивные из свинины
Как приготовить отбивные с грибами;Рецепты вкусных отбивных с грибами, которые легко приготовить дома;Простые секреты вкусных отбивных с грибами. Научись готовить лучше!;как приготовить отбивные с грибами
Как приготовить отбивные с сыром ;Рецепты вкусных отбивных с сыром, которые легко приготовить дома;Простые секреты вкусных отбивных с сыром . Научись готовить лучше!;как приготовить отбивные с сыром 
Как приготовить пельмени в горшочках;Рецепты вкусных пельменей в горшочках, которые легко приготовить дома;Простые секреты вкусных пельменей в горшочках. Научись готовить лучше!;как приготовить пельмени  в горшочках
Как приготовить пельмени сибирские;Рецепты вкусных пельменей сибирских, которые легко приготовить дома;Простые секреты вкусных пельменей сибирских. Научись готовить лучше!;как приготовить пельмени сибирские
Как приготовить перец фаршированный;Рецепты вкусного перца фаршированного, который легко приготовить дома;Простые секреты вкусного перца фаршированного. Научись готовить лучше!;как приготовить перец фаршированный
Как приготовить плов из говядины;Рецепты вкусного плова из говядины, который легко приготовить дома;Простые секреты вкусного плова из говядины. Научись готовить лучше!;как приготовить плов из говядины
Как приготовить плов из курицы;Рецепты вкусного плова из курицы, который легко приготовить дома;Простые секреты вкусного плова из курицы. Научись готовить лучше!;как приготовить плов из курицы
Как приготовить плов из свинины;Рецепты вкусного плова из свинины, который легко приготовить дома;Простые секреты вкусного плова из свинины. Научись готовить лучше!;как приготовить плов из  свинины
Как приготовить плов из баранины;Рецепты вкусного плова из баранины, который легко приготовить дома;Простые секреты вкусного плова из баранины. Научись готовить лучше!;как приготовить плов из баранины
Как приготовить узбекский  плов ;Рецепты вкусного узбекского плова, который легко приготовить дома;Простые секреты вкусного узбекского плова. Научись готовить лучше!;как приготовить узбекский плов
Как приготовить  пюре из гороха;Рецепты вкусного овощного пюре из гороха, которое легко приготовить дома;Простые секреты вкусного овощного пюре из гороха. Научись готовить лучше!;как приготовить пюре из гороха
Как приготовить  пюре из тыквы;Рецепты вкусного пюре из тыквы, которое легко приготовить дома;Простые секреты вкусного пюре из тыквы. Научись готовить лучше!;как приготовить  пюре из тыквы
Как приготовить пюре из цветной капусты;Рецепты вкусного  пюре из цветной капусты, которое легко приготовить дома;Простые секреты вкусного  пюре из цветной капусты. Научись готовить лучше!;как приготовить  пюре из цветной капусты
Как приготовить рататуй;Рецепты вкусного рататуйя, который легко приготовить дома;Простые секреты вкусного рататуйя. Научись готовить лучше!;как приготовить рататуй
Как приготовить ризотто;Рецепты вкусного ризотто, которое легко приготовить дома;Простые секреты вкусного ризотто. Научись готовить лучше!;как приготовить ризотто
Как приготовить ростбиф;Рецепты вкусный ростбиф, который легко приготовить дома;Простые секреты вкусного ростбифа. Научись готовить лучше!;как приготовить ростбиф
Как приготовить тефтели;Рецепты вкусных тефтелей, которые легко приготовить дома;Простые секреты вкусных тефтелей. Научись готовить лучше!;как приготовить тефтели
