;;;;;;;;;;"Корейские салаты";;"Некоторые молодые домохозяйки сомневаются в том как приготовить корейские салаты. Однако, этот рецепт не такой уж сложный. Обыденная кухня содержит много секретов. Даже то, что написано о ней классиками, после внимательного прочтения является не совсем очевидно. Считается, что знание как приготовить корейские салаты является доступным для начинающей хозяйки. Скажем честно, это вопрос во многом неоднозначный.<br> Мы поделимся одним из доступных способов готовки этого блюда. Это блюдо сложно назвать историческим (хотя почему?). Но по своему вкусу ему, пожалуй, сложно подыскать сильного конкурента. <br> Ознакомьтесь с нашей статьей и узнайте как правильно приготовить это вкусное блюдо, мы надеемся что наша статья окажется для вас интересной. Как минимум, Вы точно познакомитесь с тем как приготовить корейские салаты. ";;"1";"0";"korejskie-salaty";"Узнай как приготовить корейские салаты. Подборка вкусных рецептов для дома с фото и видео. Читай!";"Корейские салаты - простые пошаговые рецепты с фото и видео";;"1";"02.07.2017 20:49:57";"0000-00-00 00:00:00";"0000-00-00 00:00:00";;;;"0";;
;;;;;;;;;;"Салат с корейской морковкой и грибами";;"Довольно часто молодые хозяйки сомневаются в том как приготовить салат с корейской морковкой и грибами. Между тем, ничего слишком сложного в этом вопросе на самом деле, нет. Классическая кухня содержит достаточно много хитростей и даже тайн. Традиционно считается, что знание как приготовить салат с корейской морковкой и грибами присуще опытной хозяйке. Честно говоря, это вопрос довольно не простой.<br> Мы решили остановиться на наиболее ярком из рецептов. Это блюдо сложно назвать историческим (хотя собственно почему?). Но по своему вкусу ему нет достойных соперников. <br> Ознакомьтесь с нашей статьей и вы узнаете как правильно приготовить это вкуснейшее блюдо, наша статья будет полезной. Вы точно будете знать как приготовить салат с корейской морковкой и грибами. Приятного чтения!";;"1";"0";"salat-s-korejskoj-morkovkoj-i-gribami";"Узнай как приготовить салат с корейской морковкой и грибами. Подборка вкусных рецептов для дома с фото и видео. Читай!";"Салат с корейской морковкой и грибами - простые пошаговые рецепты с фото и видео";;"1";"02.07.2017 20:49:57";"0000-00-00 00:00:00";"0000-00-00 00:00:00";;;;"0";;
;;;;;;;;;;"Салат с корейской морковью и свежим огурцом";;"Как правило, юные пользователи соцсети Фейсбук сомневаются в том как приготовить салат с корейской морковью и свежим огурцом. Однако, этот рецепт не такой уж сложный. Традиционная кулинария содержит много загадок и даже тайн. Даже то, что описано в классических работах, при подробном знакомстве с предметом оказывается неожиданным. Считается, что понимание как приготовить салат с корейской морковью и свежим огурцом присуще любой и каждой домохозяйке. Так ли это – вопрос спорный.<br> Мы же остановимся на наиболее доступном из рецептов. Этот рецепт нельзя называть традиционным (хотя собственно почему?). Но по насыщенности вкусом ему, пожалуй, нет достойных конкурентов в своем классе. <br> Ознакомьтесь с нашей инструкцией и вы узнаете как нужно готовить это вкуснейшее блюдо, наша статья окажется интересной. Как минимум, Вы точно будете уверены в том как приготовить салат с корейской морковью и свежим огурцом. Приятного чтения!";;"1";"0";"salat-s-korejskoj-morkovju-i-svezhim-ogurcom";"Узнай как приготовить салат с корейской морковью и свежим огурцом. Подборка вкусных рецептов для дома с фото и видео. Читай!";"Салат с корейской морковью и свежим огурцом - простые пошаговые рецепты с фото и видео";;"1";"02.07.2017 20:49:57";"0000-00-00 00:00:00";"0000-00-00 00:00:00";;;;"0";;
;;;;;;;;;;"Салат с курицей корейской морковью и огурцом";;"Довольно часто молодые хозяйки не уверены как приготовить салат с курицей корейской морковью и огурцом. Однако, ничего слишком тяжелого в этом рецепте нет. Традиционная кулинария, как оказывается, содержит много загадок. Даже то, что описано в классических трудах, после пристального изучения оказывается не так очевидно. Считается, что понимание как приготовить салат с курицей корейской морковью и огурцом является простым для молодой домохозяйки. Так ли это – вопрос во многом спорный.<br> Мы поделимся одним из ярких способов готовки этого блюда. Этот способ готовки только с натяжкой можно считать традиционным. Но по насыщенности вкусом ему нет достойных соперников. <br> Прочитайте нашу инструкцию и узнайте как нужно готовить это вкуснейшее блюдо, из нее вы узнаете о популярном блюде что-то новое. Вы точно познакомитесь с тем как приготовить салат с курицей корейской морковью и огурцом. Итак, устраивайтесь поудобнее, мы начинаем!";;"1";"0";"salat-s-kuricej-korejskoj-morkovju-i-ogurcom";"Узнай как приготовить салат с курицей корейской морковью и огурцом. Подборка вкусных рецептов для дома с фото и видео. Читай!";"Салат с курицей корейской морковью и огурцом - простые пошаговые рецепты с фото и видео";;"1";"02.07.2017 20:49:57";"0000-00-00 00:00:00";"0000-00-00 00:00:00";;;;"0";;
;;;;;;;;;;"Салат с корейской морковью и грибами";;" Любая национальная кухня несет в себе много хитростей. Многие считают, что понимание как приготовить салат с корейской морковью и грибами присуще и каждой хозяйке. Скажем честно, это вопрос довольно спорный.<br> Мы поделимся одним из простых способов готовки этого блюда. Этот рецепт нельзя назвать выдающимся. Но по своему вкусу ему, пожалуй, сложно подобрать конкурента в своем классе. <br> Изучите нашу статью и узнайте как правильно приготовить это вкусное блюдо, мы надеемся что наша статья может оказаться интересной. По крайней мере, Вы точно познакомитесь с тем как приготовить салат с корейской морковью и грибами. Желаем Вам приятного чтения!";;"1";"0";"salat-s-korejskoj-morkovju-i-gribami";"Узнай как приготовить салат с корейской морковью и грибами. Подборка вкусных рецептов для дома с фото и видео. Читай!";"Салат с корейской морковью и грибами - простые пошаговые рецепты с фото и видео";;"1";"02.07.2017 20:49:57";"0000-00-00 00:00:00";"0000-00-00 00:00:00";;;;"0";;
;;;;;;;;;;"Корейский салат из капусты";;" Обыденная кухня содержит много хитростей. Довольно часто то, что писали о ней кулинарные эксперты, при подробном знакомстве с предметом является иногда удивительным. Считается, что знание как приготовить корейский салат из капусты присуще любой зрелой домохозяйке. Скажем честно, это вопрос довольно не простой.<br> Мы же решили остановиться на наиболее доступном из рецептов. Это блюдо нельзя назвать историческим. Но по насыщенности вкусом ему нет сильных конкурентов в своем классе. <br> Изучите нашу инструкцию и будете знать как нужно готовить это вкуснейшее блюдо, мы надеемся что из нее вы узнаете много нового. По крайней мере, Вы точно узнаете как приготовить корейский салат из капусты. ";;"1";"0";"korejskij-salat-iz-kapusty";"Узнай как приготовить корейский салат из капусты. Подборка вкусных рецептов для дома с фото и видео. Читай!";"Корейский салат из капусты - простые пошаговые рецепты с фото и видео";;"1";"02.07.2017 20:49:57";"0000-00-00 00:00:00";"0000-00-00 00:00:00";;;;"0";;
;;;;;;;;;;"Салат с копченой рыбой";;"Некоторые юные домохозяйки сомневаются в том как приготовить салат с копченой рыбой. Впрочем, ничего сложного в этом рецепте нет. Обыденная кухня, как оказывается, несет в себе достаточно много секретов и даже тайн. Считается, что понимание как приготовить салат с копченой рыбой присуще любой начинающей домохозяйке. Честно говоря, это вопрос во многом риторический.<br> Мы поделимся в этой статье одним из простых рецептов. Этот способ готовки только с натяжкой можно называть историческим (хотя почему?). Но по насыщенности вкусом ему нет конкурентов. <br> Изучите нашу инструкцию и будете знать как нужно готовить это вкуснейшее блюдо, из нее вы узнаете много нового. По крайней мере, Вы точно будете знать как приготовить салат с копченой рыбой. ";;"1";"0";"salat-s-kopchenoj-ryboj";"Узнай как приготовить салат с копченой рыбой. Подборка вкусных рецептов для дома с фото и видео. Читай!";"Салат с копченой рыбой - простые пошаговые рецепты с фото и видео";;"1";"02.07.2017 20:49:57";"0000-00-00 00:00:00";"0000-00-00 00:00:00";;;;"0";;
;;;;;;;;;;"Салат с копченой скумбрией";;"Некоторые зрители программы "Все буде смачно" не уверены как приготовить салат с копченой скумбрией. Однако, ничего сложного в этом вопросе на самом деле, нет. Русская кухня, как оказывается, содержит много загадок и даже тайн. Довольно часто то, что написано о ней классиками, при подробном знакомстве с предметом оказывается неожиданным. Многие считают, что знание как приготовить салат с копченой скумбрией является доступным для начинающей домохозяйки. Вынуждены признать, это вопрос не такой простой.<br> Мы поделимся в этой статье одним из ярких способов готовки этого блюда. Этот рецепт только с натяжкой можно считать выдающимся. Но по насыщенности вкусом ему, пожалуй, нет равных в своем классе. <br> Изучите нашу инструкцию и вы узнаете как нужно готовить это вкуснейшее блюдо, из нее вы узнаете о популярном блюде кое-что новое. Как минимум, Вы точно будете уверены в том как приготовить салат с копченой скумбрией. Итак, устраивайтесь поудобнее, и мы начнем!";;"1";"0";"salat-s-kopchenoj-skumbriej";"Узнай как приготовить салат с копченой скумбрией. Подборка вкусных рецептов для дома с фото и видео. Читай!";"Салат с копченой скумбрией - простые пошаговые рецепты с фото и видео";;"1";"02.07.2017 20:49:57";"0000-00-00 00:00:00";"0000-00-00 00:00:00";;;;"0";;
;;;;;;;;;;"Салат с копченой красной рыбой";;"Довольно часто пользователи соцсетей не уверены как приготовить салат с копченой красной рыбой. Между тем, ничего слишком тяжелого в этом вопросе на самом деле, нет. Русская кулинария имеет достаточно много хитростей. Многие считают, что знание как приготовить салат с копченой красной рыбой присуще и каждой хозяйке. Это вопрос во многом риторический.<br> Мы поделимся в этой статье одним из самых простых способов готовки этого блюда. Этот рецепт вряд ли можно называть традиционным. Но по своей яркости ему, пожалуй, нет достойных конкурентов. <br> Ознакомьтесь с нашей статьей и будете знать как правильно приготовить это вкусное блюдо, мы надеемся что из нее вы узнаете о популярном блюде много нового. Вы точно будете уверены в том как приготовить салат с копченой красной рыбой. ";;"1";"0";"salat-s-kopchenoj-krasnoj-ryboj";"Узнай как приготовить салат с копченой красной рыбой. Подборка вкусных рецептов для дома с фото и видео. Читай!";"Салат с копченой красной рыбой - простые пошаговые рецепты с фото и видео";;"1";"02.07.2017 20:49:57";"0000-00-00 00:00:00";"0000-00-00 00:00:00";;;;"0";;
;;;;;;;;;;"Салат из скумбрии";;" Привычная кухня, как оказывается, содержит много хитростей и даже тайн. Многие считают, что знание как приготовить салат из скумбрии является известным для любой домохозяйки. Честно говоря, это вопрос во многом не такой простой.<br> Мы поделимся одним из ярких способов готовки этого блюда. Это блюдо только с натяжкой можно назвать традиционным. Но по своему вкусу ему нет достойных соперников. <br> Ознакомьтесь с нашей статьей и будете знать как нужно готовить это вкуснейшее блюдо, мы думаем что из нее вы подчерпнете о популярном блюде много нового. Как минимум, Вы точно познакомитесь с тем как приготовить салат из скумбрии. Приятного чтения!";;"1";"0";"salat-iz-skumbrii";"Узнай как приготовить салат из скумбрии. Подборка вкусных рецептов для дома с фото и видео. Читай!";"Салат из скумбрии - простые пошаговые рецепты с фото и видео";;"1";"02.07.2017 20:49:57";"0000-00-00 00:00:00";"0000-00-00 00:00:00";;;;"0";;
;;;;;;;;;;"Салат из вареной скумбрии";;" Любая национальная кулинария несет в себе много хитростей и даже тайн. Довольно часто то, что описано в классических трудах, после внимательного прочтения является не так очевидно. Многие считают, что знание как приготовить салат из вареной скумбрии является присущим для каждой домохозяйки. Честно говоря, это вопрос не простой.<br> Мы же решили остановиться на наиболее ярком из рецептов. Этот рецепт сложно считать выдающимся. Но по насыщенности вкусом ему нет сильных конкурентов. <br> Ознакомьтесь с нашей статьей и вы узнаете как правильно приготовить это вкуснейшее блюдо, из нее вы узнаете для себя много нового. Вы точно узнаете как приготовить салат из вареной скумбрии. ";;"1";"0";"salat-iz-varenoj-skumbrii";"Узнай как приготовить салат из вареной скумбрии. Подборка вкусных рецептов для дома с фото и видео. Читай!";"Салат из вареной скумбрии - простые пошаговые рецепты с фото и видео";;"1";"02.07.2017 20:49:57";"0000-00-00 00:00:00";"0000-00-00 00:00:00";;;;"0";;
;;;;;;;;;;"Салат из соленой скумбрии";;"Довольно часто пользователи соцсети Фейсбук не знают как приготовить салат из соленой скумбрии. Впрочем, этот вопрос довольно простой. Традиционная кухня, как оказывается, имеет много секретов и даже тайн. Даже то, что писали о ней кулинарные эксперты, при детальном разборе становится иногда удивительным. Считается, что знание как приготовить салат из соленой скумбрии присуще любой молодой хозяйке. Это вопрос во многом не простой.<br> Мы остановимся на самом ярком из рецептов. Этот рецепт сложно назвать выдающимся. Но по оригинальности ему, пожалуй, нет равных. <br> Изучите нашу статью и узнайте как правильно приготовить это вкусное блюдо, из нее вы подчерпнете о кулинарии что-то новое. Как минимум, Вы точно узнаете как приготовить салат из соленой скумбрии. Приятного аппетита!";;"1";"0";"salat-iz-solenoj-skumbrii";"Узнай как приготовить салат из соленой скумбрии. Подборка вкусных рецептов для дома с фото и видео. Читай!";"Салат из соленой скумбрии - простые пошаговые рецепты с фото и видео";;"1";"02.07.2017 20:49:57";"0000-00-00 00:00:00";"0000-00-00 00:00:00";;;;"0";;
;;;;;;;;;;"Салат с копченой рыбой и картофелем";;" Классическая кухня несет в себе достаточно много хитростей и даже тайн. Даже то, что написано о ней классиками, после пристального изучения оказывается иногда удивительным. Традиционно считается, что знание как приготовить салат с копченой рыбой и картофелем присуще зрелой хозяйке. Так ли это – вопрос довольно спорный.<br> Мы же остановимся на самом доступном из рецептов. Этот способ готовки нельзя считать выдающимся. Но по своему вкусу ему нет сильных конкурентов. <br> Читайте нашу статью и узнайте как правильно приготовить это вкусное блюдо, мы надеемся что наша статья может оказаться интересной. Как минимум, Вы точно будете уверены в том как приготовить салат с копченой рыбой и картофелем. Приятного аппетита!";;"1";"0";"salat-s-kopchenoj-ryboj-i-kartofelem";"Узнай как приготовить салат с копченой рыбой и картофелем. Подборка вкусных рецептов для дома с фото и видео. Читай!";"Салат с копченой рыбой и картофелем - простые пошаговые рецепты с фото и видео";;"1";"02.07.2017 20:49:57";"0000-00-00 00:00:00";"0000-00-00 00:00:00";;;;"0";;
