;;;;;;;;;;"Салат с корейской морковью и курицей и грибами";;"Многие юные домохозяйки не знают как приготовить салат с корейской морковью и курицей и грибами. Впрочем, этот рецепт не такой сложный как кажется. Традиционная кулинария, как оказывается, содержит достаточно много загадок. Многие считают, что знание как приготовить салат с корейской морковью и курицей и грибами является простым для зрелой домохозяйки. Вынуждены признать, это вопрос неоднозначный.<br> Мы решили поделиться одним из самых доступных способов готовки этого блюда. Это блюдо сложно называть традиционным (хотя собственно почему?). Но по оригинальности ему нет сильных соперников. <br> Изучите нашу инструкцию и вы узнаете как нужно готовить это вкусное блюдо, мы уверены что из нее вы узнаете о популярном блюде много нового. Как минимум, Вы точно будете знать как приготовить салат с корейской морковью и курицей и грибами. ";;"1";"0";"salat-s-korejskoj-morkovju-i-kuricej-i-gribami";"Узнай как приготовить салат с корейской морковью и курицей и грибами. Подборка вкусных рецептов для дома с фото и видео. Читай!";"Салат с корейской морковью и курицей и грибами - простые пошаговые рецепты с фото и видео";;"1";"02.07.2017 20:49:57";"0000-00-00 00:00:00";"0000-00-00 00:00:00";;;;"0";;
;;;;;;;;;;"Салат из свеклы с сыром";;"Как правило, хозяйки не уверены как приготовить салат из свеклы с сыром. Однако, ничего тяжелого в этом вопросе нет. Любая национальная кухня содержит достаточно много хитростей. Даже то, что описано в классических работах, при подробном знакомстве с предметом становится неожиданным. Считается, что понимание как приготовить салат из свеклы с сыром присуще любой начинающей хозяйке. Это вопрос не очень простой.<br> Мы же решили остановиться на самом доступном из рецептов. Этот рецепт сложно считать традиционным. Но по своей яркости ему, пожалуй, нет равных. <br> Изучите нашу статью и узнайте как нужно готовить это вкуснейшее блюдо, наша статья окажется для вас полезной. По крайней мере, Вы точно будете знать как приготовить салат из свеклы с сыром. Желаем Вам приятного чтения!";;"1";"0";"salat-iz-svekly-s-syrom";"Узнай как приготовить салат из свеклы с сыром. Подборка вкусных рецептов для дома с фото и видео. Читай!";"Салат из свеклы с сыром - простые пошаговые рецепты с фото и видео";;"1";"02.07.2017 20:49:57";"0000-00-00 00:00:00";"0000-00-00 00:00:00";;;;"0";;
;;;;;;;;;;"Салат свекла с чесноком";;"Как правило, молодые зрители программы "Все буде смачно" сомневаются в том как приготовить салат свекла с чесноком. Между тем, этот вопрос не такой сложный как кажется. Привычная кухня, как оказывается, содержит много секретов. Считается, что знание как приготовить салат свекла с чесноком является известным для каждой хозяйки. Это вопрос неоднозначный.<br> Мы поделимся с вами одним из доступных рецептов. Этот способ готовки сложно назвать выдающимся (хотя почему?). Но по насыщенности вкусом ему нет достойных конкурентов в своем классе. <br> Изучите нашу статью и вы узнаете как правильно приготовить это вкусное блюдо, мы надеемся что из нее вы узнаете о популярном блюде много нового. По крайней мере, Вы точно познакомитесь с тем как приготовить салат свекла с чесноком. Желаем Вам приятного чтения!";;"1";"0";"salat-svekla-s-chesnokom";"Узнай как приготовить салат свекла с чесноком. Подборка вкусных рецептов для дома с фото и видео. Читай!";"Салат свекла с чесноком - простые пошаговые рецепты с фото и видео";;"1";"02.07.2017 20:49:57";"0000-00-00 00:00:00";"0000-00-00 00:00:00";;;;"0";;
;;;;;;;;;;"Салат со свеклой и яблоком";;" Классическая кухня несет в себе много хитростей и даже тайн. Считается, что понимание как приготовить салат со свеклой и яблоком присуще опытной хозяйке. Это вопрос довольно не такой простой.<br> Мы же остановимся на наиболее ярком из рецептов. Этот рецепт нельзя называть историческим. Но по насыщенности вкусом ему нет сильных соперников в своем классе. <br> Изучите нашу статью и узнайте как нужно готовить это вкусное блюдо, мы уверены что из нее вы узнаете о кулинарии и кухне много нового. По крайней мере, Вы точно познакомитесь с тем как приготовить салат со свеклой и яблоком. Приятного аппетита!";;"1";"0";"salat-so-svekloj-i-jablokom";"Узнай как приготовить салат со свеклой и яблоком. Подборка вкусных рецептов для дома с фото и видео. Читай!";"Салат со свеклой и яблоком - простые пошаговые рецепты с фото и видео";;"1";"02.07.2017 20:49:57";"0000-00-00 00:00:00";"0000-00-00 00:00:00";;;;"0";;
;;;;;;;;;;"Салат из свиного языка";;"Довольно часто юные хозяйки не знают как приготовить салат из свиного языка. Между тем, ничего слишком невозможного в этом блюде нет. Русская кулинария содержит достаточно много хитростей и даже тайн. Довольно часто то, что писали о ней классики, после пристального изучения является не так очевидно. Многие считают, что знание как приготовить салат из свиного языка присуще любой зрелой хозяйке. Скажем честно, это вопрос во многом не простой.<br> Мы решили поделиться в этой статье одним из простых рецептов. Это блюдо только с натяжкой можно считать традиционным. Но по оригинальности ему нет равных. <br> Ознакомьтесь с нашей статьей и вы узнаете как нужно готовить это вкуснейшее блюдо, из нее вы узнаете о популярном блюде кое-что новое. По крайней мере, Вы точно узнаете как приготовить салат из свиного языка. Приятного чтения!";;"1";"0";"salat-iz-svinogo-jazyka";"Узнай как приготовить салат из свиного языка. Подборка вкусных рецептов для дома с фото и видео. Читай!";"Салат из свиного языка - простые пошаговые рецепты с фото и видео";;"1";"02.07.2017 20:49:57";"0000-00-00 00:00:00";"0000-00-00 00:00:00";;;;"0";;
;;;;;;;;;;"Салат с говяжьим языком";;" Любая национальная кухня, как оказывается, имеет достаточно много загадок и даже тайн. Довольно часто то, что описано в классических трудах, при подробном знакомстве с предметом оказывается иногда удивительным. Считается, что знание как приготовить салат с говяжьим языком присуще опытной хозяйке. Это вопрос довольно не совсем простой.<br> Мы поделимся в этой статье одним из самых ярких рецептов. Это блюдо вряд ли можно считать выдающимся (хотя почему?). Но по своей яркости ему нет равных в своем классе. <br> Читайте нашу инструкцию и вы узнаете как правильно приготовить это вкусное блюдо, наша статья окажется интересной. По крайней мере, Вы точно будете знать как приготовить салат с говяжьим языком. Желаем Вам приятного чтения!";;"1";"0";"salat-s-govjazhim-jazykom";"Узнай как приготовить салат с говяжьим языком. Подборка вкусных рецептов для дома с фото и видео. Читай!";"Салат с говяжьим языком - простые пошаговые рецепты с фото и видео";;"1";"02.07.2017 20:49:57";"0000-00-00 00:00:00";"0000-00-00 00:00:00";;;;"0";;
;;;;;;;;;;"Салат с баклажанами и грибами";;"Как правило, любители программы "Адская кухня" сомневаются в том как приготовить салат с баклажанами и грибами. Между тем, этот вопрос довольно простой. Обыденная кухня имеет достаточно много загадок и даже тайн. Довольно часто то, что писали о ней кулинарные эксперты, после пристального изучения оказывается не так очевидно. Традиционно считается, что понимание как приготовить салат с баклажанами и грибами присуще молодой домохозяйке. Честно говоря, это вопрос во многом риторический.<br> Мы поделимся на этой странице одним из самых доступных рецептов. Этот рецепт сложно назвать выдающимся. Но по своему вкусу ему нет соперников в своем классе. <br> Изучите нашу статью и узнайте как правильно приготовить это вкусное блюдо, из нее вы узнаете о кулинарии много нового. Вы точно познакомитесь с тем как приготовить салат с баклажанами и грибами. ";;"1";"0";"salat-s-baklazhanami-i-gribami";"Узнай как приготовить салат с баклажанами и грибами. Подборка вкусных рецептов для дома с фото и видео. Читай!";"Салат с баклажанами и грибами - простые пошаговые рецепты с фото и видео";;"1";"02.07.2017 20:49:57";"0000-00-00 00:00:00";"0000-00-00 00:00:00";;;;"0";;
;;;;;;;;;;"Салат из баклажанов по корейски";;"Многие юные любители программы "Мастер-шеф" не уверены как приготовить салат из баклажанов по корейски. Между тем, этот рецепт не такой сложный как кажется. Классическая кулинария содержит много загадок. Традиционно считается, что понимание как приготовить салат из баклажанов по корейски присуще любой молодой домохозяйке. Честно говоря, это вопрос довольно спорный.<br> Мы поделимся на этой странице одним из доступных рецептов. Этот рецепт сложно назвать историческим (хотя собственно почему?). Но по насыщенности вкусом ему, пожалуй, нет равных. <br> Ознакомьтесь с нашей статьей и узнайте как нужно готовить это вкуснейшее блюдо, мы думаем что из нее вы узнаете о секретах готовки кое-что новое. По крайней мере, Вы точно будете уверены в том как приготовить салат из баклажанов по корейски. Итак, устраивайтесь поудобнее, и мы начнем!";;"1";"0";"salat-iz-baklazhanov-po-korejski";"Узнай как приготовить салат из баклажанов по корейски. Подборка вкусных рецептов для дома с фото и видео. Читай!";"Салат из баклажанов по корейски - простые пошаговые рецепты с фото и видео";;"1";"02.07.2017 20:49:57";"0000-00-00 00:00:00";"0000-00-00 00:00:00";;;;"0";;
;;;;;;;;;;"Салат из цветной капусты на зиму";;" Привычная кухня несет в себе достаточно много хитростей. Многие считают, что знание как приготовить салат из цветной капусты на зиму является присущим для зрелой хозяйки. Честно говоря, это вопрос риторический.<br> Мы же остановимся на наиболее простом из рецептов. Это блюдо нельзя считать традиционным. Но по оригинальности ему, пожалуй, сложно найти конкурента в своем классе. <br> Ознакомьтесь с нашей инструкцией и будете знать как нужно готовить это вкусное блюдо, мы надеемся что наша статья будет для вас полезной. Вы точно будете уверены в том как приготовить салат из цветной капусты на зиму. Итак, устраивайтесь поудобнее, мы начинаем!";;"1";"0";"salat-iz-cvetnoj-kapusty-na-zimu";"Узнай как приготовить салат из цветной капусты на зиму. Подборка вкусных рецептов для дома с фото и видео. Читай!";"Салат из цветной капусты на зиму - простые пошаговые рецепты с фото и видео";;"1";"02.07.2017 20:49:57";"0000-00-00 00:00:00";"0000-00-00 00:00:00";;;;"0";;
;;;;;;;;;;"Салат с красной капустой";;"Некоторые молодые хозяйки сомневаются в том как приготовить салат с красной капустой. Впрочем, этот рецепт не такой сложный как кажется. Классическая кулинария, как оказывается, имеет достаточно много хитростей и даже тайн. Даже то, что писали о ней кулинарные знатоки, после внимательного прочтения становится неожиданным. Традиционно считается, что знание как приготовить салат с красной капустой присуще любой опытной домохозяйке. Это вопрос спорный.<br> Мы поделимся в этой статье одним из самых ярких способов готовки этого блюда. Это блюдо вряд ли можно считать традиционным. Но по насыщенности вкусом ему нет равных в своем классе. <br> Читайте нашу инструкцию и узнайте как правильно приготовить это вкусное блюдо, мы думаем что из нее вы узнаете много нового. По крайней мере, Вы точно будете уверены в том как приготовить салат с красной капустой. Приятного чтения!";;"1";"0";"salat-s-krasnoj-kapustoj";"Узнай как приготовить салат с красной капустой. Подборка вкусных рецептов для дома с фото и видео. Читай!";"Салат с красной капустой - простые пошаговые рецепты с фото и видео";;"1";"02.07.2017 20:49:57";"0000-00-00 00:00:00";"0000-00-00 00:00:00";;;;"0";;
;;;;;;;;;;"Салат из краснокочанной капусты на зиму";;" Обыденная кулинария имеет достаточно много загадок. Довольно часто то, что описано в классических трудах, после внимательного прочтения становится не так очевидно. Считается, что понимание как приготовить салат из краснокочанной капусты на зиму присуще молодой домохозяйке. Честно говоря, это вопрос довольно не совсем простой.<br> Мы поделимся на этой странице одним из доступных способов готовки этого блюда. Этот рецепт нельзя называть историческим. Но по своей яркости ему, пожалуй, сложно подобрать достойного соперника. <br> Изучите нашу инструкцию и вы узнаете как нужно готовить это вкусное блюдо, мы уверены что из нее вы узнаете что-то новое. Как минимум, Вы точно познакомитесь с тем как приготовить салат из краснокочанной капусты на зиму. Приятного чтения!";;"1";"0";"salat-iz-krasnokochannoj-kapusty-na-zimu";"Узнай как приготовить салат из краснокочанной капусты на зиму. Подборка вкусных рецептов для дома с фото и видео. Читай!";"Салат из краснокочанной капусты на зиму - простые пошаговые рецепты с фото и видео";;"1";"02.07.2017 20:49:57";"0000-00-00 00:00:00";"0000-00-00 00:00:00";;;;"0";;
;;;;;;;;;;"Салат из морской капусты";;"Многие молодые любители программы "Шеф-повар не знают как приготовить салат из морской капусты. Впрочем, этот вопрос не такой уж сложный. Привычная кухня, как оказывается, имеет достаточно много секретов и даже тайн. Считается, что понимание как приготовить салат из морской капусты присуще опытной домохозяйке. Честно говоря, это вопрос неоднозначный.<br> Мы же решили остановиться на самом доступном из рецептов. Это блюдо сложно называть историческим (хотя почему?). Но по своей яркости ему, пожалуй, сложно выбрать сильного конкурента. <br> Ознакомьтесь с нашей статьей и узнайте как правильно приготовить это вкуснейшее блюдо, наша статья окажется для вас интересной. По крайней мере, Вы точно узнаете как приготовить салат из морской капусты. Приятного чтения!";;"1";"0";"salat-iz-morskoj-kapusty";"Узнай как приготовить салат из морской капусты. Подборка вкусных рецептов для дома с фото и видео. Читай!";"Салат из морской капусты - простые пошаговые рецепты с фото и видео";;"1";"02.07.2017 20:49:57";"0000-00-00 00:00:00";"0000-00-00 00:00:00";;;;"0";;
;;;;;;;;;;"Салат с чипсами";;"Довольно часто юные хозяйки не уверены как приготовить салат с чипсами. Однако, этот рецепт довольно простой. Классическая кухня имеет достаточно много хитростей. Даже то, что написано о ней классиками, после пристального изучения является иногда удивительным. Многие считают, что понимание как приготовить салат с чипсами является простым для зрелой хозяйки. Вынуждены признать, это вопрос во многом спорный.<br> Мы же остановимся на самом ярком из рецептов. Этот рецепт вряд ли можно считать традиционным (хотя почему?). Но по насыщенности вкусом ему, пожалуй, сложно выбрать соперника. <br> Изучите нашу инструкцию и вы узнаете как нужно готовить это вкуснейшее блюдо, из нее вы подчерпнете для себя много нового. Как минимум, Вы точно будете знать как приготовить салат с чипсами. Желаем Вам приятного чтения!";;"1";"0";"salat-s-chipsami";"Узнай как приготовить салат с чипсами. Подборка вкусных рецептов для дома с фото и видео. Читай!";"Салат с чипсами - простые пошаговые рецепты с фото и видео";;"1";"02.07.2017 20:49:57";"0000-00-00 00:00:00";"0000-00-00 00:00:00";;;;"0";;
