;;;;;;;;;;"Салат из синей капусты";;" Традиционная кухня содержит много хитростей и даже тайн. Довольно часто то, что написано о ней классиками, при детальном разборе является не совсем очевидно. Считается, что понимание как приготовить салат из синей капусты является простым для начинающей хозяйки. Скажем честно, это вопрос довольно спорный.<br> Мы решили поделиться с вами одним из доступных рецептов. Этот способ готовки вряд ли можно называть историческим. Но по своей яркости ему сложно подобрать конкурента. <br> Прочитайте нашу статью и узнайте как правильно приготовить это вкусное блюдо, мы уверены что из нее вы узнаете для себя много нового. По крайней мере, Вы точно будете знать как приготовить салат из синей капусты. Итак, устраивайтесь поудобнее, и мы начнем!";;"1";"0";"salat-iz-sinej-kapusty";"Узнай как приготовить салат из синей капусты. Подборка вкусных рецептов для дома с фото и видео. Читай!";"Салат из синей капусты - простые пошаговые рецепты с фото и видео";;"1";"02.07.2017 20:49:57";"0000-00-00 00:00:00";"0000-00-00 00:00:00";;;;"0";;
;;;;;;;;;;"Салат из краснокочанной капусты";;" Русская кулинария содержит много хитростей и даже тайн. Многие считают, что понимание как приготовить салат из краснокочанной капусты присуще зрелой домохозяйке. Это вопрос не очень простой.<br> Мы решили поделиться на этой странице одним из простых способов готовки этого блюда. Это блюдо нельзя считать традиционным. Но по своему вкусу ему, пожалуй, нет достойных соперников в своем классе. <br> Изучите нашу инструкцию и будете знать как нужно готовить это вкусное блюдо, мы думаем что из нее вы узнаете много нового. Вы точно будете уверены в том как приготовить салат из краснокочанной капусты. Приятного аппетита!";;"1";"0";"salat-iz-krasnokochannoj-kapusty";"Узнай как приготовить салат из краснокочанной капусты. Подборка вкусных рецептов для дома с фото и видео. Читай!";"Салат из краснокочанной капусты - простые пошаговые рецепты с фото и видео";;"1";"02.07.2017 20:49:57";"0000-00-00 00:00:00";"0000-00-00 00:00:00";;;;"0";;
;;;;;;;;;;"Салат из капусты на зиму";;"Как правило, любители программы "Все буде смачно" сомневаются в том как приготовить салат из капусты на зиму. Между тем, ничего нерешаемого в этом вопросе нет. Русская кулинария, как оказывается, содержит достаточно много загадок и даже тайн. Даже то, что описано в классических трудах, при подробном знакомстве с предметом является иногда удивительным. Многие считают, что понимание как приготовить салат из капусты на зиму является известным для начинающей хозяйки. Честно говоря, это вопрос довольно неоднозначный.<br> Мы решили поделиться одним из простых рецептов. Этот рецепт нельзя называть выдающимся. Но по своей яркости ему нет конкурентов в своем классе. <br> Ознакомьтесь с нашей инструкцией и узнайте как нужно готовить это вкусное блюдо, наша статья может оказаться для вас полезной. Как минимум, Вы точно будете знать как приготовить салат из капусты на зиму. Приятного аппетита!";;"1";"0";"salat-iz-kapusty-na-zimu";"Узнай как приготовить салат из капусты на зиму. Подборка вкусных рецептов для дома с фото и видео. Читай!";"Салат из капусты на зиму - простые пошаговые рецепты с фото и видео";;"1";"02.07.2017 20:49:57";"0000-00-00 00:00:00";"0000-00-00 00:00:00";;;;"0";;
;;;;;;;;;;"Салат из капусты и перца на зиму";;"Как правило, юные домохозяйки не уверены как приготовить салат из капусты и перца на зиму. Однако, этот рецепт не такой сложный как кажется. Любая национальная кулинария несет в себе достаточно много секретов и даже тайн. Довольно часто то, что описано в классических работах, при детальном разборе становится не совсем очевидно. Многие считают, что понимание как приготовить салат из капусты и перца на зиму является простым для любой домохозяйки. Это вопрос довольно не простой.<br> Мы же решили остановиться на наиболее доступном из рецептов. Этот рецепт только с натяжкой можно считать традиционным. Но по насыщенности вкусом ему нет достойных соперников в своем классе. <br> Прочитайте нашу инструкцию и узнайте как нужно готовить это вкуснейшее блюдо, мы уверены что наша статья может оказаться для вас интересной. По крайней мере, Вы точно будете уверены в том как приготовить салат из капусты и перца на зиму. Приятного чтения!";;"1";"0";"salat-iz-kapusty-i-perca-na-zimu";"Узнай как приготовить салат из капусты и перца на зиму. Подборка вкусных рецептов для дома с фото и видео. Читай!";"Салат из капусты и перца на зиму - простые пошаговые рецепты с фото и видео";;"1";"02.07.2017 20:49:57";"0000-00-00 00:00:00";"0000-00-00 00:00:00";;;;"0";;
;;;;;;;;;;"Салат на зиму с капустой и помидорами";;" Русская кухня содержит достаточно много секретов и даже тайн. Считается, что понимание как приготовить салат на зиму с капустой и помидорами является присущим для зрелой домохозяйки. Так ли это – вопрос не такой простой.<br> Мы остановимся на самом простом из рецептов. Этот способ готовки сложно называть традиционным (хотя почему?). Но по насыщенности вкусом ему, пожалуй, нет равных. <br> Изучите нашу инструкцию и будете знать как нужно готовить это вкусное блюдо, мы уверены что из нее вы подчерпнете что-то новое. Вы точно будете уверены в том как приготовить салат на зиму с капустой и помидорами. ";;"1";"0";"salat-na-zimu-s-kapustoj-i-pomidorami";"Узнай как приготовить салат на зиму с капустой и помидорами. Подборка вкусных рецептов для дома с фото и видео. Читай!";"Салат на зиму с капустой и помидорами - простые пошаговые рецепты с фото и видео";;"1";"02.07.2017 20:49:57";"0000-00-00 00:00:00";"0000-00-00 00:00:00";;;;"0";;
;;;;;;;;;;"Салат с корейской морковью";;"Некоторые телезрители кулинарных программ сомневаются в том как приготовить салат с корейской морковью. Впрочем, ничего нерешаемого в этом вопросе нет. Любая национальная кулинария, как оказывается, содержит много секретов и даже тайн. Довольно часто то, что писали о ней исследователи, при подробном знакомстве с предметом оказывается не так очевидно. Считается, что понимание как приготовить салат с корейской морковью присуще опытной хозяйке. Это вопрос довольно не такой простой.<br> Мы решили поделиться с вами одним из доступных способов готовки этого блюда. Этот способ готовки вряд ли можно называть традиционным (хотя собственно почему?). Но по своему вкусу ему, пожалуй, сложно найти соперника. <br> Прочитайте нашу статью и узнайте как нужно готовить это вкуснейшее блюдо, наша статья окажется полезной. Вы точно познакомитесь с тем как приготовить салат с корейской морковью. ";;"1";"0";"salat-s-korejskoj-morkovju";"Узнай как приготовить салат с корейской морковью. Подборка вкусных рецептов для дома с фото и видео. Читай!";"Салат с корейской морковью - простые пошаговые рецепты с фото и видео";;"1";"02.07.2017 20:49:57";"0000-00-00 00:00:00";"0000-00-00 00:00:00";;;;"0";;
;;;;;;;;;;"Сколько варить свеклу для салата";;" Классическая кухня несет в себе много хитростей и даже тайн. Довольно часто то, что описано в классических работах, при подробном знакомстве с предметом становится не совсем очевидно. Традиционно считается, что понимание как приготовить сколько варить свеклу для салата является присущим для зрелой домохозяйки. Скажем честно, это вопрос во многом спорный.<br> Мы решили поделиться на этой странице одним из самых ярких способов готовки этого блюда. Это блюдо нельзя называть традиционным (хотя почему?). Но по насыщенности вкусом ему, пожалуй, нет соперников. <br> Читайте нашу статью и узнайте как правильно приготовить это вкусное блюдо, мы надеемся что наша статья может оказаться для вас интересной. Как минимум, Вы точно будете уверены в том как приготовить сколько варить свеклу для салата. Итак, устраивайтесь поудобнее, и мы начнем!";;"1";"0";"skolko-varit-sveklu-dlja-salata";"Узнай как приготовить сколько варить свеклу для салата. Подборка вкусных рецептов для дома с фото и видео. Читай!";"Сколько варить свеклу для салата - простые пошаговые рецепты с фото и видео";;"1";"02.07.2017 20:49:57";"0000-00-00 00:00:00";"0000-00-00 00:00:00";;;;"0";;
;;;;;;;;;;"Салат с морковью по корейски";;"Как правило, юные пользователи соцсети Вконтакте не уверены как приготовить салат с морковью по корейски. Впрочем, этот вопрос не такой уж сложный. Привычная кухня, как оказывается, содержит много секретов. Даже то, что описано в классических работах, после пристального изучения оказывается неожиданным. Традиционно считается, что понимание как приготовить салат с морковью по корейски является присущим для начинающей хозяйки. Вынуждены признать, это вопрос риторический.<br> Мы же остановимся на самом ярком из рецептов. Это блюдо только с натяжкой можно называть традиционным (хотя почему?). Но по насыщенности вкусом ему сложно выбрать сильного соперника в своем классе. <br> Ознакомьтесь с нашей статьей и будете знать как нужно готовить это вкусное блюдо, мы уверены что наша статья может оказаться интересной. По крайней мере, Вы точно будете знать как приготовить салат с морковью по корейски. ";;"1";"0";"salat-s-morkovju-po-korejski";"Узнай как приготовить салат с морковью по корейски. Подборка вкусных рецептов для дома с фото и видео. Читай!";"Салат с морковью по корейски - простые пошаговые рецепты с фото и видео";;"1";"02.07.2017 20:49:57";"0000-00-00 00:00:00";"0000-00-00 00:00:00";;;;"0";;
;;;;;;;;;;"Салат с корейской морковкой";;"Некоторые юные любители программы "Мастер-шеф" сомневаются в том как приготовить салат с корейской морковкой. Однако, ничего тяжелого в этом вопросе на самом деле, нет. Традиционная кухня, как оказывается, содержит много секретов. Даже то, что написано о ней классиками, при детальном разборе становится неожиданным. Считается, что знание как приготовить салат с корейской морковкой присуще любой и каждой хозяйке. Так ли это – вопрос не такой простой.<br> Мы поделимся в этой статье одним из самых доступных способов готовки этого блюда. Этот способ готовки сложно назвать традиционным. Но по насыщенности вкусом ему, пожалуй, сложно подыскать достойного соперника в своем классе. <br> Прочитайте нашу статью и узнайте как правильно приготовить это вкусное блюдо, мы уверены что из нее вы подчерпнете кое-что новое. Как минимум, Вы точно познакомитесь с тем как приготовить салат с корейской морковкой. Приятного аппетита!";;"1";"0";"salat-s-korejskoj-morkovkoj";"Узнай как приготовить салат с корейской морковкой. Подборка вкусных рецептов для дома с фото и видео. Читай!";"Салат с корейской морковкой - простые пошаговые рецепты с фото и видео";;"1";"02.07.2017 20:49:57";"0000-00-00 00:00:00";"0000-00-00 00:00:00";;;;"0";;
;;;;;;;;;;"Салат морковча";;" Привычная кулинария, как оказывается, содержит много загадок и даже тайн. Даже то, что описано в классических трудах, после внимательного прочтения оказывается неожиданным. Многие считают, что знание как приготовить салат морковча является известным для любой хозяйки. Это вопрос не совсем простой.<br> Мы же остановимся на самом доступном из рецептов. Это блюдо нельзя называть выдающимся. Но по оригинальности ему, пожалуй, сложно подобрать достойного конкурента в своем классе. <br> Ознакомьтесь с нашей статьей и вы узнаете как правильно приготовить это вкуснейшее блюдо, наша статья может оказаться полезной. Вы точно узнаете как приготовить салат морковча. ";;"1";"0";"salat-morkovcha";"Узнай как приготовить салат морковча. Подборка вкусных рецептов для дома с фото и видео. Читай!";"Салат морковча - простые пошаговые рецепты с фото и видео";;"1";"02.07.2017 20:49:57";"0000-00-00 00:00:00";"0000-00-00 00:00:00";;;;"0";;
;;;;;;;;;;"Корейский салат";;"Некоторые юные домохозяйки не уверены как приготовить корейский салат. Между тем, этот рецепт не такой уж сложный. Любая национальная кухня, как оказывается, имеет много секретов. Даже то, что писали о ней кулинарные эксперты, при подробном знакомстве с предметом становится не совсем очевидно. Считается, что знание как приготовить корейский салат является присущим для начинающей домохозяйки. Так ли это – вопрос во многом не такой простой.<br> Мы поделимся одним из самых ярких рецептов. Это блюдо нельзя называть выдающимся (хотя собственно почему?). Но по своему вкусу ему нет достойных соперников в своем классе. <br> Читайте нашу инструкцию и будете знать как нужно готовить это вкуснейшее блюдо, из нее вы подчерпнете о секретах готовки много нового. Вы точно будете знать как приготовить корейский салат. Итак, устраивайтесь поудобнее, и мы начнем!";;"1";"0";"korejskij-salat";"Узнай как приготовить корейский салат. Подборка вкусных рецептов для дома с фото и видео. Читай!";"Корейский салат - простые пошаговые рецепты с фото и видео";;"1";"02.07.2017 20:49:57";"0000-00-00 00:00:00";"0000-00-00 00:00:00";;;;"0";;
;;;;;;;;;;"Салат с корейской морковкой и курицей";;"Многие пользователи соцсети Фейсбук не знают как приготовить салат с корейской морковкой и курицей. Однако, ничего невозможного в этом блюде нет. Русская кулинария содержит много хитростей. Традиционно считается, что знание как приготовить салат с корейской морковкой и курицей является доступным для любой хозяйки. Скажем честно, это вопрос довольно спорный.<br> Мы же решили остановиться на самом доступном из рецептов. Этот способ готовки нельзя назвать историческим (хотя почему?). Но по оригинальности ему нет достойных соперников. <br> Изучите нашу инструкцию и вы узнаете как нужно готовить это вкусное блюдо, из нее вы узнаете о кулинарии много нового. Как минимум, Вы точно будете уверены в том как приготовить салат с корейской морковкой и курицей. Желаем Вам приятного чтения!";;"1";"0";"salat-s-korejskoj-morkovkoj-i-kuricej";"Узнай как приготовить салат с корейской морковкой и курицей. Подборка вкусных рецептов для дома с фото и видео. Читай!";"Салат с корейской морковкой и курицей - простые пошаговые рецепты с фото и видео";;"1";"02.07.2017 20:49:57";"0000-00-00 00:00:00";"0000-00-00 00:00:00";;;;"0";;
;;;;;;;;;;"Салат корейский";;"Многие юные хозяйки не уверены как приготовить салат корейский. Между тем, этот рецепт довольно простой. Любая национальная кулинария несет в себе достаточно много секретов и даже тайн. Даже то, что написано о ней классиками, при детальном разборе становится не так очевидно. Многие считают, что знание как приготовить салат корейский является доступным для молодой домохозяйки. Честно говоря, это вопрос довольно не простой.<br> Мы решили поделиться в этой статье одним из ярких способов готовки этого блюда. Этот способ готовки нельзя назвать традиционным. Но по оригинальности ему, пожалуй, нет равных. <br> Ознакомьтесь с нашей статьей и вы узнаете как нужно готовить это вкусное блюдо, мы уверены что наша статья окажется интересной. Вы точно узнаете как приготовить салат корейский. ";;"1";"0";"salat-korejskij";"Узнай как приготовить салат корейский. Подборка вкусных рецептов для дома с фото и видео. Читай!";"Салат корейский - простые пошаговые рецепты с фото и видео";;"1";"02.07.2017 20:49:57";"0000-00-00 00:00:00";"0000-00-00 00:00:00";;;;"0";;
