;;;;;;;;;;"Салат цезарь";;"Как правило, хозяйки не уверены как приготовить салат цезарь. Между тем, этот рецепт не такой уж сложный. Классическая кулинария несет в себе много секретов. Довольно часто то, что описано в классических работах, после внимательного прочтения становится не совсем очевидно. Считается, что знание как приготовить салат цезарь присуще и каждой хозяйке. Скажем честно, это вопрос не такой простой.<br> Мы решили остановиться на наиболее ярком из рецептов. Это блюдо вряд ли можно называть выдающимся. Но по оригинальности ему, пожалуй, нет конкурентов в своем классе. <br> Изучите нашу инструкцию и узнайте как нужно готовить это вкуснейшее блюдо, мы уверены что из нее вы узнаете о кулинарии и кухне кое-что новое. Как минимум, Вы точно узнаете как приготовить салат цезарь. ";;"1";"0";"salat-cezar";"Узнай как приготовить салат цезарь. Подборка вкусных рецептов для дома с фото и видео. Читай!";"Салат цезарь - простые пошаговые рецепты с фото и видео";;"1";"02.07.2017 20:49:57";"0000-00-00 00:00:00";"0000-00-00 00:00:00";;;;"0";;
;;;;;;;;;;"Салат в лаваше";;"Как правило, хозяйки сомневаются в том как приготовить салат в лаваше. Между тем, ничего слишком сложного в этом вопросе на самом деле, нет. Русская кулинария несет в себе много загадок и даже тайн. Даже то, что писали о ней классики, после внимательного прочтения оказывается иногда удивительным. Традиционно считается, что понимание как приготовить салат в лаваше присуще опытной хозяйке. Честно говоря, это вопрос довольно спорный.<br> Мы решили поделиться на этой странице одним из самых доступных способов готовки этого блюда. Этот рецепт сложно назвать выдающимся. Но по оригинальности ему, пожалуй, нет равных. <br> Прочитайте нашу инструкцию и будете знать как правильно приготовить это вкуснейшее блюдо, мы надеемся что из нее вы подчерпнете для себя много нового. Вы точно будете знать как приготовить салат в лаваше. Итак, устраивайтесь поудобнее, и мы начнем!";;"1";"0";"salat-v-lavashe";"Узнай как приготовить салат в лаваше. Подборка вкусных рецептов для дома с фото и видео. Читай!";"Салат в лаваше - простые пошаговые рецепты с фото и видео";;"1";"02.07.2017 20:49:57";"0000-00-00 00:00:00";"0000-00-00 00:00:00";;;;"0";;
;;;;;;;;;;"Салат лечо на зиму";;" Привычная кухня имеет много загадок. Многие считают, что понимание как приготовить салат лечо на зиму присуще любой зрелой хозяйке. Честно говоря, это вопрос во многом риторический.<br> Мы же остановимся на самом доступном из рецептов. Этот рецепт только с натяжкой можно считать традиционным (хотя собственно почему?). Но по своей яркости ему, пожалуй, нет достойных конкурентов. <br> Ознакомьтесь с нашей статьей и будете знать как правильно приготовить это вкуснейшее блюдо, мы уверены что наша статья может оказаться интересной. Вы точно познакомитесь с тем как приготовить салат лечо на зиму. Приятного чтения!";;"1";"0";"salat-lecho-na-zimu";"Узнай как приготовить салат лечо на зиму. Подборка вкусных рецептов для дома с фото и видео. Читай!";"Салат лечо на зиму - простые пошаговые рецепты с фото и видео";;"1";"02.07.2017 20:49:57";"0000-00-00 00:00:00";"0000-00-00 00:00:00";;;;"0";;
;;;;;;;;;;"Салат лечо";;"Некоторые юные любители программы "Все буде смачно" не знают как приготовить салат лечо. Впрочем, этот вопрос не такой сложный как кажется. Русская кухня, как оказывается, содержит много хитростей. Даже то, что описано в классических работах, после пристального изучения оказывается иногда удивительным. Многие считают, что понимание как приготовить салат лечо присуще любой зрелой хозяйке. Честно говоря, это вопрос довольно не простой.<br> Мы решили остановиться на наиболее ярком из рецептов. Это блюдо только с натяжкой можно назвать выдающимся (хотя почему?). Но по насыщенности вкусом ему сложно подыскать достойного соперника в своем классе. <br> Ознакомьтесь с нашей статьей и будете знать как нужно готовить это вкуснейшее блюдо, наша статья будет полезной. Вы точно будете знать как приготовить салат лечо. ";;"1";"0";"salat-lecho";"Узнай как приготовить салат лечо. Подборка вкусных рецептов для дома с фото и видео. Читай!";"Салат лечо - простые пошаговые рецепты с фото и видео";;"1";"02.07.2017 20:49:57";"0000-00-00 00:00:00";"0000-00-00 00:00:00";;;;"0";;
;;;;;;;;;;"Салат с ветчиной и помидорами";;"Как правило, юные домохозяйки не знают как приготовить салат с ветчиной и помидорами. Между тем, этот рецепт не такой сложный как кажется. Привычная кухня содержит достаточно много загадок. Считается, что знание как приготовить салат с ветчиной и помидорами присуще любой молодой хозяйке. Это вопрос неоднозначный.<br> Мы поделимся с вами одним из простых рецептов. Этот способ готовки только с натяжкой можно считать историческим. Но по своей яркости ему нет равных в своем классе. <br> Изучите нашу статью и узнайте как правильно приготовить это вкусное блюдо, мы надеемся что наша статья может оказаться полезной. Вы точно познакомитесь с тем как приготовить салат с ветчиной и помидорами. ";;"1";"0";"salat-s-vetchinoj-i-pomidorami";"Узнай как приготовить салат с ветчиной и помидорами. Подборка вкусных рецептов для дома с фото и видео. Читай!";"Салат с ветчиной и помидорами - простые пошаговые рецепты с фото и видео";;"1";"02.07.2017 20:49:57";"0000-00-00 00:00:00";"0000-00-00 00:00:00";;;;"0";;
;;;;;;;;;;"Салат с зеленым горошком";;"Довольно часто юные пользователи интернета сомневаются в том как приготовить салат с зеленым горошком. Однако, ничего невозможного в этом рецепте нет. Традиционная кухня, как оказывается, имеет достаточно много загадок. Считается, что понимание как приготовить салат с зеленым горошком присуще любой начинающей хозяйке. Честно говоря, это вопрос довольно спорный.<br> Мы решили поделиться в этой статье одним из доступных рецептов. Этот способ готовки нельзя считать традиционным (хотя собственно почему?). Но по оригинальности ему, пожалуй, сложно найти достойного конкурента. <br> Ознакомьтесь с нашей статьей и будете знать как правильно приготовить это вкусное блюдо, мы думаем что из нее вы подчерпнете о кулинарии и кухне кое-что новое. По крайней мере, Вы точно будете уверены в том как приготовить салат с зеленым горошком. Приятного аппетита!";;"1";"0";"salat-s-zelenym-goroshkom";"Узнай как приготовить салат с зеленым горошком. Подборка вкусных рецептов для дома с фото и видео. Читай!";"Салат с зеленым горошком - простые пошаговые рецепты с фото и видео";;"1";"02.07.2017 20:49:57";"0000-00-00 00:00:00";"0000-00-00 00:00:00";;;;"0";;
;;;;;;;;;;"Салат с горошком и огурцом";;" Привычная кухня содержит достаточно много загадок и даже тайн. Считается, что понимание как приготовить салат с горошком и огурцом является простым для любой домохозяйки. Это вопрос довольно не простой.<br> Мы поделимся на этой странице одним из самых ярких рецептов. Этот способ готовки нельзя называть выдающимся. Но по насыщенности вкусом ему нет равных в своем классе. <br> Прочитайте нашу инструкцию и вы узнаете как правильно приготовить это вкуснейшее блюдо, мы надеемся что из нее вы подчерпнете что-то новое. Вы точно познакомитесь с тем как приготовить салат с горошком и огурцом. Приятного аппетита!";;"1";"0";"salat-s-goroshkom-i-ogurcom";"Узнай как приготовить салат с горошком и огурцом. Подборка вкусных рецептов для дома с фото и видео. Читай!";"Салат с горошком и огурцом - простые пошаговые рецепты с фото и видео";;"1";"02.07.2017 20:49:57";"0000-00-00 00:00:00";"0000-00-00 00:00:00";;;;"0";;
;;;;;;;;;;"Салат с мясом и горошком";;" Любая национальная кухня, как оказывается, имеет много хитростей и даже тайн. Традиционно считается, что понимание как приготовить салат с мясом и горошком присуще начинающей хозяйке. Это вопрос не совсем простой.<br> Мы же решили остановиться на наиболее ярком из рецептов. Этот рецепт сложно считать выдающимся. Но по насыщенности вкусом ему, пожалуй, сложно подыскать сильного конкурента. <br> Ознакомьтесь с нашей статьей и узнайте как правильно приготовить это вкусное блюдо, мы надеемся что наша статья может оказаться для вас полезной. По крайней мере, Вы точно будете уверены в том как приготовить салат с мясом и горошком. ";;"1";"0";"salat-s-mjasom-i-goroshkom";"Узнай как приготовить салат с мясом и горошком. Подборка вкусных рецептов для дома с фото и видео. Читай!";"Салат с мясом и горошком - простые пошаговые рецепты с фото и видео";;"1";"02.07.2017 20:49:57";"0000-00-00 00:00:00";"0000-00-00 00:00:00";;;;"0";;
;;;;;;;;;;"Салат с горошком";;"Как правило, юные хозяйки не уверены как приготовить салат с горошком. Впрочем, этот рецепт довольно простой. Любая национальная кулинария, как оказывается, содержит достаточно много секретов. Многие считают, что знание как приготовить салат с горошком присуще любой молодой домохозяйке. Честно говоря, это вопрос не такой простой.<br> Мы поделимся с вами одним из доступных способов готовки этого блюда. Это блюдо только с натяжкой можно называть историческим (хотя почему?). Но по насыщенности вкусом ему, пожалуй, сложно выбрать сильного конкурента. <br> Прочитайте нашу инструкцию и будете знать как нужно готовить это вкусное блюдо, из нее вы подчерпнете о популярном блюде много нового. Как минимум, Вы точно узнаете как приготовить салат с горошком. ";;"1";"0";"salat-s-goroshkom";"Узнай как приготовить салат с горошком. Подборка вкусных рецептов для дома с фото и видео. Читай!";"Салат с горошком - простые пошаговые рецепты с фото и видео";;"1";"02.07.2017 20:49:57";"0000-00-00 00:00:00";"0000-00-00 00:00:00";;;;"0";;
;;;;;;;;;;"Салат из цветной капусты";;" Привычная кулинария, как оказывается, несет в себе достаточно много загадок и даже тайн. Традиционно считается, что понимание как приготовить салат из цветной капусты является присущим для каждой домохозяйки. Это вопрос довольно не совсем простой.<br> Мы же решили остановиться на наиболее простом из рецептов. Это блюдо нельзя назвать историческим. Но по своей яркости ему, пожалуй, сложно подобрать достойного соперника в своем классе. <br> Ознакомьтесь с нашей инструкцией и будете знать как правильно приготовить это вкуснейшее блюдо, мы думаем что из нее вы узнаете о популярном блюде кое-что новое. По крайней мере, Вы точно будете уверены в том как приготовить салат из цветной капусты. ";;"1";"0";"salat-iz-cvetnoj-kapusty";"Узнай как приготовить салат из цветной капусты. Подборка вкусных рецептов для дома с фото и видео. Читай!";"Салат из цветной капусты - простые пошаговые рецепты с фото и видео";;"1";"02.07.2017 20:49:57";"0000-00-00 00:00:00";"0000-00-00 00:00:00";;;;"0";;
;;;;;;;;;;"Салат со шпинатом";;"Довольно часто молодые хозяйки не уверены как приготовить салат со шпинатом. Однако, ничего невозможного в этом вопросе нет. Любая национальная кулинария содержит много загадок. Традиционно считается, что понимание как приготовить салат со шпинатом является доступным для любой домохозяйки. Честно говоря, это вопрос во многом риторический.<br> Мы решили остановиться на наиболее доступном из рецептов. Это блюдо сложно считать выдающимся. Но по оригинальности ему нет равных. <br> Прочитайте нашу инструкцию и узнайте как правильно приготовить это вкуснейшее блюдо, мы надеемся что из нее вы подчерпнете о популярном блюде кое-что новое. Вы точно будете знать как приготовить салат со шпинатом. ";;"1";"0";"salat-so-shpinatom";"Узнай как приготовить салат со шпинатом. Подборка вкусных рецептов для дома с фото и видео. Читай!";"Салат со шпинатом - простые пошаговые рецепты с фото и видео";;"1";"02.07.2017 20:49:57";"0000-00-00 00:00:00";"0000-00-00 00:00:00";;;;"0";;
;;;;;;;;;;"Салат из баклажан на зиму";;"Довольно часто молодые хозяйки не уверены как приготовить салат из баклажан на зиму. Однако, этот рецепт не такой сложный как кажется. Русская кулинария, как оказывается, имеет много секретов и даже тайн. Даже то, что описано в классических работах, при подробном знакомстве с предметом становится не так очевидно. Традиционно считается, что понимание как приготовить салат из баклажан на зиму является доступным для начинающей домохозяйки. Вынуждены признать, это вопрос спорный.<br> Мы поделимся на этой странице одним из ярких способов готовки этого блюда. Этот рецепт только с натяжкой можно называть выдающимся (хотя собственно почему?). Но по насыщенности вкусом ему, пожалуй, нет равных в своем классе. <br> Ознакомьтесь с нашей статьей и вы узнаете как нужно готовить это вкуснейшее блюдо, из нее вы узнаете о секретах готовки что-то новое. По крайней мере, Вы точно узнаете как приготовить салат из баклажан на зиму. Итак, устраивайтесь поудобнее, и мы начнем!";;"1";"0";"salat-iz-baklazhan-na-zimu";"Узнай как приготовить салат из баклажан на зиму. Подборка вкусных рецептов для дома с фото и видео. Читай!";"Салат из баклажан на зиму - простые пошаговые рецепты с фото и видео";;"1";"02.07.2017 20:49:57";"0000-00-00 00:00:00";"0000-00-00 00:00:00";;;;"0";;
;;;;;;;;;;"Салат из баклажанов на зиму тещин язык";;"Некоторые юные зрители кулинарных программ сомневаются в том как приготовить салат из баклажанов на зиму тещин язык. Однако, ничего тяжелого в этом рецепте нет. Привычная кулинария содержит много хитростей. Даже то, что описано в классических работах, при детальном разборе становится иногда удивительным. Считается, что знание как приготовить салат из баклажанов на зиму тещин язык является известным для зрелой домохозяйки. Честно говоря, это вопрос неоднозначный.<br> Мы решили остановиться на самом ярком из рецептов. Это блюдо сложно называть традиционным (хотя почему?). Но по своей яркости ему, пожалуй, нет достойных соперников в своем классе. <br> Изучите нашу инструкцию и узнайте как правильно приготовить это вкуснейшее блюдо, мы уверены что наша статья будет полезной. Вы точно узнаете как приготовить салат из баклажанов на зиму тещин язык. Приятного чтения!";;"1";"0";"salat-iz-baklazhanov-na-zimu-tecshin-jazyk";"Узнай как приготовить салат из баклажанов на зиму тещин язык. Подборка вкусных рецептов для дома с фото и видео. Читай!";"Салат из баклажанов на зиму тещин язык - простые пошаговые рецепты с фото и видео";;"1";"02.07.2017 20:49:57";"0000-00-00 00:00:00";"0000-00-00 00:00:00";;;;"0";;
;;;;;;;;;;"Салат на зиму из баклажанов и помидоров";;" Русская кухня, как оказывается, несет в себе достаточно много секретов. Считается, что понимание как приготовить салат на зиму из баклажанов и помидоров является присущим для начинающей домохозяйки. Вынуждены признать, это вопрос во многом риторический.<br> Мы решили поделиться одним из самых доступных способов готовки этого блюда. Этот рецепт нельзя назвать традиционным. Но по оригинальности ему, пожалуй, нет равных. <br> Ознакомьтесь с нашей статьей и будете знать как нужно готовить это вкусное блюдо, из нее вы узнаете для себя кое-что новое. По крайней мере, Вы точно познакомитесь с тем как приготовить салат на зиму из баклажанов и помидоров. Приятного чтения!";;"1";"0";"salat-na-zimu-iz-baklazhanov-i-pomidorov";"Узнай как приготовить салат на зиму из баклажанов и помидоров. Подборка вкусных рецептов для дома с фото и видео. Читай!";"Салат на зиму из баклажанов и помидоров - простые пошаговые рецепты с фото и видео";;"1";"02.07.2017 20:49:57";"0000-00-00 00:00:00";"0000-00-00 00:00:00";;;;"0";;
