"Заголовок","Title"," Description"
"Что можно садить на огороде в июле","Посадка овощей и зелени в июле - сбор второго урожая","Какие культуры можно садить и сеять в середине лета, чтобы они поспели к осени. Как собрать два урожая за год без особых усилий. Как максимально полезно распределить землю"
"Как обрезать плодовые деревья","Правильная обрезка плодовых деревьев","Когда и как необходимо обрезать плодовые деревья, что бы они максимально плодоносили, и при этом не навредить самому дереву"
"Как вырастить базилик на огороде","Секреты выращивания базилика на даче","Что необходимо знать, для того чтобы выращивать базилик на своём огороде без особых усилий."
"Как вырастить салат на грядке","Выращивание салата на огороде - советы по уходу","Как самомтоятельно вырастить салат на даче и получить большой урожай - рекомендации по уходу, поливу, высадке и сбору урожая."
"Как вырастить зелень на подоконнике или балконе","Можно ли вырастить зелень на балконе и собрать хороший урожай","Советы по выращиванию зелени на балконе, как ухаживать за зеленью, чтобы получить хороший урожай"
"Как вырастить лук-севок самостоятельно","Как можно самостоятельно вырастить лук-севок","Советы по выращиванию лука-севка в домашних условиях, как ухаживать, полевать ,собирать и хранить лук-севок."
"Как собрать два урожая картофеля","Когда можно садить картофель второй раз","Когда можно садить картофель второй раз, чтобы собрать второй урожай за год - советы по высадке и уходу за картофелем"
"Какие есть способы посадки картофеля","Как правильно садить картофель - разные способы посадки","Какие есть способы посадки картофеля. Как выбрать наиболее удобный способ посадки картофеля для своего огорода, что нужно учесть при высадке картофеля на огроде."
"Как вырастить огурцы мелотрия на садовом учатке","Выращивание огруцов мелотрия - на даче ","Советы по высадке и уходу за огурцами сорта ""Мелотрия"" на огороде, когда и как садить, поливать, ухаживать"
"Как  вырастить лук на открытом грунте","Выращивание лука на открытом грунте","Что необходимо знать, чтобы вырастить большой урожай лука на огороде - советы по уходу за луком и сбору урожая"
"Как вырастить сладкий перец на своём участке","Выращивание болгарского перца на открытом грунте","Какие особенности по выращиванию сладкого болгарского перца на открытом грунте"
"Как вырастить кабачок на своём участке","Особенности ухода и полива за кабачком на открытом грунте","Как правильно ухаживать за кабачком, чтобы получить большой и вкусный урожай "
"Как врастить капусту на открытом грунте","Выращивание капусты на огороде - особенности культуры","Как правильно ухаживать за капустой, чтобы получить высокий урожай"
"Как поливать морковь","Полив моркови на огроде","Рекомендации о способе и частотности полива моркови. Как правильно поливать морковь, чтобы получить вкусный и большой урожай"
"Как вырастить пекинскую капусту ","Как выращивать пекинскую капусту в открытом грунте","Как правильно ухаживать за пекинской капустой на своём огороде, чтобы получить большой урожай."
"Как вырастить горох на даче","Как вырастить горох на открытом грунте","Советы по выращиванию и уходу за горохом на открытом грунте. "
"Как вырастить горох в домашних условиях","Как вырастить горох на подоконнике","Советы по выращиванию и уходу за горохом в домашних условиях"
"Как вырастить баклажаны на грядке","Уход и выращивание баклажан на даче","Как правильно ухаживать за баклажанами, чтобы получить красивый и вкусный урожай. Как поливать, подкармливать, лечить от болезней и вредителей баклажаны на огороде."
"Как бороться с тлёй на смородине","Что делать, если на смородине завелась тля - методы борьбы","Как избавиться от тли на смородине - разные проверенные методы борьбы. Профилактические работы от тли на смородине."
"Как правильно ухаживать за фасолью на грядке","Как вырастить фасоль на даче","Как ухаживать за фасолью, чтобы собрать высокий урожай"
"Как вырастить спаржу - стрючковую фасоль","Как правильно выращивать стрючковую фасоль на огороде","Советы по уходу и выращиванию спаржи - стрючковой фасоли на даче"
"Какие культуры можно садить в одной теплице","Какие культуры будут расти в одной теплице","Что можно высажывать в одной теплице. Какие культуры будут хорошо расти в теплице и не мешать друг другу - на заметку огородникам."
"Как повысить урожайность участка","Увеличение урожайностисадового участка","Какие меры предпринять, чтобы увеличить урожайность садового участка."
"Как вырастить виноград из черенка","Способы выращивания винограда из черенка","Какой необходим уход, чтобы вырастить виноград из черенка. Возможно ли вырастить виноград из черенка, чтобы он отлично плодоносил."
"Как посадить морковь под зиму на даче","Посадка моркови на зиму на огороде","Когда и как правильно садить морков под зиму, чтобы семена принялись и дали большой урожай."
"Что делать, если чеснок взошёл осенью","Как быть с чесноком, который взошёл осенью.","Что необходимо сделать, если чеснок взошёл осенью. Что сделать, чтобы не погубить урожай."
"Как выращивать арбузы","Особенности выращивания и ухода за арбузами","Как вырастить большой и вкусный урожай арбузов. В чём особенность ухода за арбузами"
"Как вырастить фасоль сортов Блюхильда и Пурпурный король","В чём особенность ухода за сортами фасоли Блюхильда и Пурпурный король","Что необходимо знать для выращивания фасоли Блюхильда и Пурпурный король."
"Когда и как собирать и хранить лук","Как собрать лук, чтобы достоял до весны","Как правильно собрать урожай лука. Когда необходимо собирать лук, чтобы он хорошо стоял. Как правильно подготовить лук на зимовку, чтобы он достоял до весны. "
"Когда и как собирать чеснок, чтобы он хорошо сохранился","Как сохранить чеснок до весны в домашних условиях","Когда необходимо собирать чеснок, чтобы он хранился до весны в домашних условиях"
"Как выбрать сорт томатов для своей грядки","Самые урожаные сорта томатов для огорода","Как правильно выбирать сорт помидор для открытого грунта, чтобы он хорошо плодоносил. Самые урожайные сорта помидор для дачи."
"Какой сорт салата не горчит","Какие сорта салатов не горчат","Как выбрать сорт салата, чтобы он не горчил"
"Что делать, если салат стрелкуется","В чём причина стрелкования салата","Какие особенности ухода за салатом, чтобы он не выпускал стрелки. Как ухаживать за салатом, чтобы он не стрелковался"
"Как вырастить чеснок Рокамболь","Особенности выращивани и ухода за чесноком Рокамболь","Как правильно ухаживать за чесноком Рокомболь, чтобы собрать высокий урожай луко-чеснока"
"Как вырастить круглый баклажан Гелиос","Особенности выращивания и ухода за баклажаном Гелиос","Как правильно выращивать круглый баклажан Гелиос. Уход, полив, температура, вредители, болезни, сбор урожая - всё что необходимо знать для выращивания баклажана Гелиос."
"Как вырастить лук за короткий срок","Можно ли вырастить лук за короткий срок","Как ухаживать за луком, чтобы получить урожай за короткий срок"
"Как вырастить кукурузу на огороде","Особенности ухода за кукурузой на даче","Как ухаживать за кукурузой, чтобы получить большой и сладкий урожай кукурузы на огороде"
"Как вырастить сельдерей корневой на открытом грунте","Особенности выращивания корня сельдерея","Как правильно выращивать сельдерей корневой на огороде"
"Как вырастить топинамбур на даче","Особенности выращивания топинамбура на огороде","Как вырастить топинамбур на даче. Как ухаживать за топинамбуром, чтобы собрать большой урожай."
"Как вырастить помидоры черри дома","Выращивание помидор черри в домашних условиях. Уход за помидорами черри ","Как вырастить помидоры черри на огороде"
"Как вырастить цветную капусту на огороде","Выращивание и уход за цветной капустой на садовом участке","Как правильно выращивать цветную капусту на даче. Уход за цветной капустой: полив, подкормка, вредители, болезни"
"Как правильно ухаживать за тыквой","Уход за тыквой на даче","Как ухаживать за тыквой, чтобы получить красивый и большой урожай"
"Как ухаживать за белокачанной капустой","Уход за белокачанной капустой на даче","Как правильно ухаживать за белокачанной капустой. Полив, подкормка, сбор урожая - всё что необходимо знать о выращивании капусты на садовом участке."
"Как удобрить земельный участок перегноем","Как правильно подготовить перегной для удобрения участка","Как готовится перегной для удобрения участка. Что важно знать при удобрении учстка перегноем."
"Как сделать универсальное натуральное удобрение ","Как готовится натуральное удобрение для всех растений","Как приготовить универсальное натуральное удобрение, которое подойдёт всем растениям на огороде. Что важно знать при подкормке"
"Как самому приготовить гумус","Изготовление гумуса собственными силами","Как самостоятельно приготовить гумус - советы из практики"
"Как приготовить биоудрбрения для дачи","Побготовка биоудобрений для огорода","Как самостоятельно приготовить биоудобрения. Что важно знать при подкормке растений биоудобрениями"
"Как Подготовить компостную яму на даче","Компостная яма на даче - особенности подготовки","Как правильно подготовить компостную яму на садовом участке - важные нюансы"
"Что необходимо сделать на даче в июле","Обязательные работы на огороде в июле","Что обязательно нужно сделать в июле на садовом участке, чтобы всё успеть. Как правильно распределить вермя в июле для работы на огороде. "
"Как вырастить арахис самостоятельно","Выращивание арахиса на даче","Особенности выращивания и ухода за арахисом на дачном участке"
"Как бороться с болезнями и вредителями баклажанов","Что делать, если завелись вредители или болезни на баклажанах","Как защитить баклажаны от болезней и вредителей. Профилактика болезней баклажанов. Как избавиться от вредителей баклажанов."
"Как избавиться от болезней плодовых деревьев","Методы борьбы с болезнями плодовых деревьев","Что важно знать о болезнях плодовых деревьев. Как бороться с болезнями плодовых деревьев."
"Как избавиться от болезней смородины","Методы борьбы с болезнями смородины","Какие есть болезни смородины, и как с ними бороться."
"Как бороться с вредителями винограда","Как побороть вредителей винограда","Что делать, если завелись вредители на винограде."
