Заголовок;Title; Description;Общий вопрос;Уникальность
Как вкусно сварить гречку;Способы приготовления гречки;Как вкусно приготовить гречку. Разные способы приготовления гречки. Как сварить гречку вкусно;как вкусно сварить гречку дома;
Как вкусно сварить макароны;Секреты приготовления макарон;Как правильно варить макароны. Что важно знать при готовке макарон;как вкусно приготовить макароны  ;
Как вкусно сварить креветки;Секреты приготовления вкусных креветок;Как вкусно отварить креветки. ;как варить замороженные креветки вкусно ;
Как вкусно сварить манную кашу;Способы приготовления манки;Как правильно варить манку. Как приготовить манку без комочков;как приготовить манку вкусно без комочков;
Как приготовить картошку в духовке;Способы запекания картошки в духовке;Как запечь картошку в духовке. Пошаговый рецепт приготовления картошки в духовке;как вкусно запечь картошку в духовке;
Как сварить варенье с клубникой;Рецепты приготовления варенья с клубникой;Как сваритьваренье с клубникой. Рецепт приготовления варенья с клубникой пошагово с фото;как сварить варенье с клубникой пошагово;
Рецепты простых салатов ;Способы приготовления простых вкусных салатов;Как просто приготовить салат. Простой рецепт приготовления салата;как приготовить вкусный салат - простой рецепт;
Как приготовить салат с курицей;Способы приготовления салата с курицей;Как приготовить салат с курицей пошагово. Рецепт салата с курицей пошагово;как приготовить салат с курицей - рецепт пошагово;
Как приготовить салат Цезарь;Способы приготовления салата Цезарь. ;Как вкусно приготовить салат Цезарь. Рецепт приготвления классического салата Цезарь;как приготовить салат Цезарь - классический рецепт;
Как готовить грибы рецепт с  фото;Секреты приготовления вкусных грибов;Как вкусно приготовить грибы. Простой рецепт приготовления грибов с фото;Как готовить грибы вкусно;
Как приготовить курицу в духовке;Советы по приготовлению курицы в духовке;Как вкусно запеч курицу в духовке. Рецепты приготовления курицы в духовке;как запечь курицу в духовке вкусно;
Как приготовить мясо  в духовке;Способы приготовления мяса в духовке;Как просто приготовить мясо в духовке. Простой рецепты приготовления мяса в духовке с фото;как вкусно запечь мясо в духовке пошаговый рецепт с фото;
Как приготовить в духовке кабачки;Способы приготовления кабачков в духовке;Как правильно запечь кабачки в духовке. Вкусные рецепты приготовления кабачка в духовке с фото;как вкусно готовить кабачки в духовке;
Закуски на праздничный стол фото;Советы по приготовлению закусок на праздничный стол. ;Рецепты вкусных закусок для праздничного стола. Какие закуски приготовить на праздничный стол - рецепты с фото;Какие простые закуски приготовить для праздничного стола;
Рецепты салатов на зиму с фото;Способы приготовления салатов на зиму;Как приготовить вкусный салат на зиму. Простые рецепты приготовления вкусных салатов на зиму;как просто приготовить вкусный салат на зиму;
